{
  "id": "g-01",
  "name": "단일 상품 카드 결제 정상 주문",
  "order": {
    "customer": "c_1001",
    "items": [{ "sku": "SKU-APPLE-1KG", "qty": 2 }],
    "payment_method": "card",
    "shipping": { "country": "KR", "express": false }
  },
  "expect": {
    "skills_called": ["order-intake", "inventory-check", "payment", "shipping-reserve", "notify"],
    "final_status": "SHIPPED",
    "shipments": 1,
    "assertions": ["payment.status == 'PAID'", "notify.sent == true"]
  },
  "k": 2
}
